{
  "eraId": "era-transition",
  "opponents": [
    {
      "candidateId": "opponent:team-chennai-super-kings:ipl-2015",
      "contentStatus": "APPROVED_FROZEN_PROFILE",
      "diagnostics": {
        "bowlingCoverage": {
          "bowlingCapacity": 4.935584,
          "familyCapacity": {
            "PACE": 3.435233,
            "SPIN": 1.500351,
            "UNKNOWN": 0.0
          },
          "normalizedBowlingUnitsAvailable": 6.042135,
          "phaseCapacity": {
            "death": 0.904989,
            "middle": 2.291335,
            "powerplay": 1.739259
          },
          "uncoveredBowlingUnits": 0.0,
          "workloadCounts": {
            "FRONTLINE": 4,
            "NONE": 3,
            "OCCASIONAL": 2,
            "SUPPORT": 2
          }
        },
        "dataCompleteness": {
          "confirmedKeeperCandidateCount": 2,
          "eligiblePlayerCount": 14,
          "issues": [],
          "joinedPlayerCount": 14,
          "status": "COMPLETE",
          "unresolvedRosterStatusCount": 0
        },
        "legality": {
          "confirmedKeeperCount": 2,
          "overseasCount": 4,
          "playerCount": 11,
          "uniqueCanonicalPlayerCount": 11
        },
        "officialParticipation": {
          "xiMatchCountMaximum": 17,
          "xiMatchCountMinimum": 10,
          "xiMatchCountTotal": 171
        },
        "positionFitCounts": {
          "ACCEPTABLE": 0,
          "NATURAL": 10,
          "OUT_OF_ROLE": 0,
          "UNKNOWN": 1
        },
        "replacementContext": {
          "diagnosticOnly": true,
          "representativeXiEvents": {
            "concussionIn": 0,
            "concussionOut": 0,
            "impactIn": 0,
            "impactOut": 0,
            "roleIn": 0,
            "roleOut": 0
          },
          "teamSeasonEvents": {
            "concussionIn": 0,
            "concussionOut": 0,
            "impactIn": 0,
            "impactOut": 0,
            "roleIn": 0,
            "roleOut": 0
          }
        },
        "reviewFlags": [
          "UNKNOWN_POSITION_FIT_PRESENT"
        ]
      },
      "eraId": "era-transition",
      "evaluation": {
        "appliedPositionFitEffect": 0.0,
        "batting": 55.453929,
        "battingCore": 57.857143,
        "battingDepth": 33.825,
        "bowling": 73.805912,
        "bowlingCapacity": 4.935584,
        "overall": 64.62992,
        "structuralBattingOrderEffect": -3.331786,
        "uncoveredBowlingUnits": 0.0
      },
      "franchiseId": "franchise-chennai-super-kings",
      "franchiseName": "Chennai Super Kings",
      "historical": {
        "netRunRate": 0.391459,
        "pointsPercentage": 0.588235
      },
      "profileTerminology": "representative historical season XI",
      "review": {
        "heuristicIsAdvisory": true,
        "membershipChanges": {
          "includedPlayerTeamSeasonIds": [],
          "omittedPlayerTeamSeasonIds": []
        },
        "overrideRationale": "retain the complete representative CSK membership while placing Bravo and Jadeja ahead of Ashwin in a credible batting order",
        "overrideType": "ORDER_ONLY",
        "rationale": "The 2015 finalist preserves CSK’s complete pre-suspension Dhoni–Raina core, with a reviewed order that places Bravo and Jadeja ahead of Ashwin.",
        "reviewedOn": "2026-09-08",
        "selectionAuthority": "HUMAN_APPROVED_MANUAL_REVIEW",
        "status": "APPROVED",
        "xiProvenance": "REVIEWED_OVERRIDE"
      },
      "schemaVersion": "ipl-era-opponent-profile/v2",
      "seasonId": "ipl-2015",
      "selectionHeuristic": {
        "advisoryOnly": true,
        "candidateScore": 0.88623,
        "historicalPerformanceZ": 0.655824,
        "qualityZ": 0.984975,
        "weights": {
          "historicalPerformance": 0.3,
          "v2Quality": 0.7
        }
      },
      "teamId": "team-chennai-super-kings",
      "teamName": "Chennai Super Kings",
      "xi": [
        {
          "displayName": "DR Smith",
          "officialListMatchCount": 16,
          "playerId": "35205dfc",
          "playerTeamSeasonId": "pts:35205dfc:ipl-2015:team-chennai-super-kings",
          "position": 1,
          "rosterStatus": "OVERSEAS"
        },
        {
          "displayName": "BB McCullum",
          "officialListMatchCount": 14,
          "playerId": "b8a55852",
          "playerTeamSeasonId": "pts:b8a55852:ipl-2015:team-chennai-super-kings",
          "position": 2,
          "rosterStatus": "OVERSEAS"
        },
        {
          "displayName": "SK Raina",
          "officialListMatchCount": 17,
          "playerId": "1dc12ab9",
          "playerTeamSeasonId": "pts:1dc12ab9:ipl-2015:team-chennai-super-kings",
          "position": 3,
          "rosterStatus": "INDIAN"
        },
        {
          "displayName": "F du Plessis",
          "officialListMatchCount": 17,
          "playerId": "3355b542",
          "playerTeamSeasonId": "pts:3355b542:ipl-2015:team-chennai-super-kings",
          "position": 4,
          "rosterStatus": "OVERSEAS"
        },
        {
          "displayName": "MS Dhoni",
          "officialListMatchCount": 17,
          "playerId": "4a8a2e3b",
          "playerTeamSeasonId": "pts:4a8a2e3b:ipl-2015:team-chennai-super-kings",
          "position": 5,
          "rosterStatus": "INDIAN"
        },
        {
          "displayName": "DJ Bravo",
          "officialListMatchCount": 17,
          "playerId": "87e562a9",
          "playerTeamSeasonId": "pts:87e562a9:ipl-2015:team-chennai-super-kings",
          "position": 6,
          "rosterStatus": "OVERSEAS"
        },
        {
          "displayName": "RA Jadeja",
          "officialListMatchCount": 17,
          "playerId": "fe93fd9d",
          "playerTeamSeasonId": "pts:fe93fd9d:ipl-2015:team-chennai-super-kings",
          "position": 7,
          "rosterStatus": "INDIAN"
        },
        {
          "displayName": "R Ashwin",
          "officialListMatchCount": 14,
          "playerId": "495d42a5",
          "playerTeamSeasonId": "pts:495d42a5:ipl-2015:team-chennai-super-kings",
          "position": 8,
          "rosterStatus": "INDIAN"
        },
        {
          "displayName": "MM Sharma",
          "officialListMatchCount": 16,
          "playerId": "759ac88f",
          "playerTeamSeasonId": "pts:759ac88f:ipl-2015:team-chennai-super-kings",
          "position": 9,
          "rosterStatus": "INDIAN"
        },
        {
          "displayName": "A Nehra",
          "officialListMatchCount": 16,
          "playerId": "96fd40ae",
          "playerTeamSeasonId": "pts:96fd40ae:ipl-2015:team-chennai-super-kings",
          "position": 10,
          "rosterStatus": "INDIAN"
        },
        {
          "displayName": "IC Pandey",
          "officialListMatchCount": 10,
          "playerId": "e0407c01",
          "playerTeamSeasonId": "pts:e0407c01:ipl-2015:team-chennai-super-kings",
          "position": 11,
          "rosterStatus": "INDIAN"
        }
      ]
    },
    {
      "candidateId": "opponent:team-delhi-daredevils:ipl-2016",
      "contentStatus": "APPROVED_FROZEN_PROFILE",
      "diagnostics": {
        "bowlingCoverage": {
          "bowlingCapacity": 4.614484,
          "familyCapacity": {
            "PACE": 3.336805,
            "SPIN": 1.277679,
            "UNKNOWN": 0.0
          },
          "normalizedBowlingUnitsAvailable": 5.573611,
          "phaseCapacity": {
            "death": 0.842261,
            "middle": 2.313889,
            "powerplay": 1.458332
          },
          "uncoveredBowlingUnits": 0.0,
          "workloadCounts": {
            "FRONTLINE": 4,
            "NONE": 4,
            "OCCASIONAL": 1,
            "SUPPORT": 2
          }
        },
        "dataCompleteness": {
          "confirmedKeeperCandidateCount": 4,
          "eligiblePlayerCount": 18,
          "issues": [],
          "joinedPlayerCount": 18,
          "status": "COMPLETE",
          "unresolvedRosterStatusCount": 0
        },
        "legality": {
          "confirmedKeeperCount": 3,
          "overseasCount": 4,
          "playerCount": 11,
          "uniqueCanonicalPlayerCount": 11
        },
        "officialParticipation": {
          "xiMatchCountMaximum": 14,
          "xiMatchCountMinimum": 8,
          "xiMatchCountTotal": 123
        },
        "positionFitCounts": {
          "ACCEPTABLE": 0,
          "NATURAL": 11,
          "OUT_OF_ROLE": 0,
          "UNKNOWN": 0
        },
        "replacementContext": {
          "diagnosticOnly": true,
          "representativeXiEvents": {
            "concussionIn": 0,
            "concussionOut": 0,
            "impactIn": 0,
            "impactOut": 0,
            "roleIn": 0,
            "roleOut": 0
          },
          "teamSeasonEvents": {
            "concussionIn": 0,
            "concussionOut": 0,
            "impactIn": 0,
            "impactOut": 0,
            "roleIn": 0,
            "roleOut": 0
          }
        },
        "reviewFlags": []
      },
      "eraId": "era-transition",
      "evaluation": {
        "appliedPositionFitEffect": 0.0,
        "batting": 58.635,
        "battingCore": 61.3,
        "battingDepth": 34.65,
        "bowling": 62.220082,
        "bowlingCapacity": 4.614484,
        "overall": 60.427541,
        "structuralBattingOrderEffect": -2.665,
        "uncoveredBowlingUnits": 0.0
      },
      "franchiseId": "franchise-delhi",
      "franchiseName": "Delhi",
      "historical": {
        "netRunRate": -0.1808,
        "pointsPercentage": 0.5
      },
      "profileTerminology": "representative historical season XI",
      "review": {
        "heuristicIsAdvisory": true,
        "membershipChanges": {
          "includedPlayerTeamSeasonIds": [],
          "omittedPlayerTeamSeasonIds": []
        },
        "overrideRationale": null,
        "overrideType": "NONE",